{
  "$schema": "https://json-schema.org/draft/2020-12/schema",
  "$id": "https://lab.local/architecture/integrations/schemas/operational-trust-preflight.schema.json",
  "title": "OPERATIONAL_TRUST_PREFLIGHT",
  "description": "Executable provider-neutral M1A contract. Structured UNRESOLVED values are permitted only where canonical sources do not establish a value.",
  "type": "object",
  "required": [
    "schema_version",
    "artifact_type",
    "authority_effect",
    "runtime_effect",
    "automatic_activation",
    "implementation_authorized",
    "required",
    "reference_environment",
    "portable_capabilities",
    "provider_adapter",
    "gates",
    "teardown",
    "normalized_result"
  ],
  "properties": {
    "schema_version": {
      "const": "1.0.0"
    },
    "artifact_type": {
      "const": "OPERATIONAL_TRUST_PREFLIGHT"
    },
    "authority_effect": {
      "const": "NONE"
    },
    "runtime_effect": {
      "const": "NONE"
    },
    "automatic_activation": {
      "const": false
    },
    "implementation_authorized": {
      "const": false
    },
    "required": {
      "const": false
    },
    "reference_environment": {
      "const": "REPOSITORY_ONLY_LOCAL_VALIDATION"
    },
    "portable_capabilities": {
      "type": "array",
      "minItems": 1,
      "items": {
        "type": "string",
        "minLength": 1
      }
    },
    "provider_adapter": {
      "const": "NONE"
    },
    "gates": {
      "type": "array",
      "minItems": 1,
      "items": {
        "type": "string",
        "minLength": 1
      }
    },
    "teardown": {
      "type": "array",
      "minItems": 1,
      "items": {
        "type": "string",
        "minLength": 1
      }
    },
    "normalized_result": {
      "const": "NOT_REQUIRED"
    }
  },
  "$defs": {
    "unresolved": {
      "type": "object",
      "required": [
        "status",
        "reason",
        "required_resolution",
        "source_refs"
      ],
      "properties": {
        "status": {
          "const": "UNRESOLVED"
        },
        "reason": {
          "type": "string",
          "minLength": 1
        },
        "required_resolution": {
          "type": "string",
          "minLength": 1
        },
        "source_refs": {
          "type": "array",
          "minItems": 1,
          "items": {
            "type": "string",
            "minLength": 1
          }
        }
      },
      "additionalProperties": false
    }
  },
  "additionalProperties": true,
  "authority_effect": "NONE",
  "runtime_effect": "NONE",
  "automatic_activation": false,
  "implementation_authorized": false
}
